{
  "schema_version": "1.0",
  "request_id": "11111111-1111-4111-8111-111111111111",
  "task_id": "22222222-2222-4222-8222-222222222222",
  "created_at": "2026-09-18T18:00:00Z",
  "source": "ui",
  "user_intent": "Create a resistor divider schematic",
  "priority": "normal",
  "workspace_id": "33333333-3333-4333-8333-333333333333",
  "requested_capabilities": [
    "engineering.kicad.schematic"
  ],
  "approval_context": {
    "required": true,
    "approval_id": null
  },
  "input_artifacts": []
}
